name,role,bio,image,email,linkedin,is_ceo,message
Hanif Ullah Khan,Chief Executive Officer,"Hanif is a visionary strategist with a deep-rooted commitment to technical excellence and systemic growth. Under his leadership, UPLYNK Tech has evolved into a premier B2B engineering cell.",/img/hanif_khan.jpeg,,,TRUE,"At UPLYNK Tech, we don't just deliver software; we architect the resilient digital systems that define the next generation of business logic."
James Wilson,Head of Engineering,James is a senior systems architect with 10+ years of experience in high-availability cloud infrastructure and cloud-native systems.,,james.wilson@uplynktech.com,https://linkedin.com,FALSE,
Sarah Johnson,Operations Director,"Sarah leads our agile delivery cycle, ensuring that every project is delivered with surgical precision and on schedule.",,sarah.johnson@uplynktech.com,https://linkedin.com,FALSE,
Priya Patel,Principal AI Lead,"Priya is a machine learning researcher specializing in large language model (LLM) fine-tuning and proprietary automation logic.",,priya.patel@uplynktech.com,https://linkedin.com,FALSE,
Marcus Chen,Business Strategy,Marcus identifies growth opportunities and ensures our technical solutions align with the core ROI goals of our partners.,,marcus.chen@uplynktech.com,https://linkedin.com,FALSE,
Emily Rodriguez,Design & UX Lead,Emily crafts high-ticket visual identities and user-centric design systems that convert and scale.,,emily.rodriguez@uplynktech.com,https://linkedin.com,FALSE,
Robert Johnson,Lead AI Instructor,"Robert bridges academic theory and industry engineering, training the next generation of top-tier AI developers.",,robert.johnson@uplynktech.com,https://linkedin.com,FALSE,
